{
  "case_id": "mockito-defects4j-MOCKITO-19",
  "provenance_quality": "pass",
  "root_cause_quality": "pass",
  "fix_quality": "pass",
  "dependency_strength": "strong",
  "dependency_evidence": "Public issue/fix provenance plus multi-class source changes were verified. Final CCDG audit remains required before promotion.",
  "ccdg_suitability": "strong",
  "contamination_risk": "unknown",
  "contamination_risk_reason": "Case-specific contamination audit has not yet been completed for this frozen Qwen checkpoint.",
  "IC1": "pass",
  "IC2": "pass",
  "IC3": "pass",
  "IC4": "pass",
  "IC5": "pass",
  "IC6": "pass",
  "IC7": "pass",
  "eligible_for_pilot": true,
  "eligible_for_main": false,
  "exclusion_reason": "Main eligibility is withheld until case-specific contamination audit and independent final ground-truth/CCDG review are complete.",
  "notes": [
    "Provisional candidate only; not part of the confirmatory benchmark."
  ]
}
