{
  "case_id": "closure-compiler-defects4j-CLOSURE-14",
  "provenance_quality": "pass",
  "root_cause_quality": "pass",
  "fix_quality": "pass",
  "dependency_strength": "strong",
  "dependency_evidence": "The public issue record and exact fixing commit identify the interacting components/layers represented in the case CCDG; no model output was consulted.",
  "ccdg_suitability": "strong",
  "contamination_risk": "high",
  "contamination_risk_reason": "Exact public defect identifier/issue record and fixing commit are accessible in the public Defects4J/project ecosystem, giving high exposure risk. This does not establish that the frozen Qwen checkpoint trained on the case.",
  "IC1": "pass",
  "IC2": "pass",
  "IC3": "pass",
  "IC4": "pass",
  "IC5": "pass",
  "IC6": "pass",
  "IC7": "pass",
  "eligible_for_pilot": true,
  "eligible_for_main": true,
  "notes": [
    "Pre-freeze assessment recorded without consulting model outputs.",
    "Exact fixing commit was checked in the public project repository.",
    "Risk label is exposure risk, not proof of contamination.",
    "Benchmark case record is prepared; manifest remains draft until the pilot gate is completed."
  ]
}
