{
  "case_id": "commons-math-defects4j-MATH-393",
  "provenance_quality": "pass",
  "root_cause_quality": "pass",
  "fix_quality": "pass",
  "dependency_strength": "moderate",
  "dependency_evidence": "Public Defects4J metadata and the case-specific fixing commit identify the interacting source components required for the provisional CCDG; no model output was consulted.",
  "ccdg_suitability": "moderate",
  "contamination_risk": "high",
  "contamination_risk_reason": "Exact public defect identifier and fixing commit are publicly accessible through the Defects4J/public project record; this creates high exposure risk but is not evidence of training-set membership.",
  "IC1": "pass",
  "IC2": "pass",
  "IC3": "pass",
  "IC4": "pass",
  "IC5": "pass",
  "IC6": "pass",
  "IC7": "pass",
  "eligible_for_pilot": true,
  "eligible_for_main": true,
  "notes": [
    "Pre-freeze assessment recorded without consulting any model outputs.",
    "Fixed revision/date were independently checked against the public fixing commit.",
    "Contamination label is a risk category, not a claim that the frozen Qwen checkpoint memorized the case.",
    "Final case file is in the confirmatory split but benchmark manifest remains draft until the pilot gate is completed."
  ]
}
