{
  "case_id": "commons-compress-github-pr-770-tar-pax-header-memory-bound",
  "provenance_quality": "pass",
  "root_cause_quality": "pass",
  "fix_quality": "pass",
  "dependency_strength": "strong",
  "dependency_evidence": "The fix threads a configurable PAX header memory bound from AbstractTarBuilder into both TarArchiveInputStream and TarFile, then through shared TarUtils parsing into the existing MemoryLimitException check. The defect/mitigation crosses builder configuration, two archive-reading APIs and shared parsing.",
  "ccdg_suitability": "strong",
  "contamination_risk": "medium",
  "contamination_risk_reason": "The exact PR and fixing revision are publicly accessible from April 2026, after the Qwen2.5 model-family release; the exact training-data cutoff is not established, so exposure cannot be ruled out.",
  "IC1": "pass",
  "IC2": "pass",
  "IC3": "pass",
  "IC4": "pass",
  "IC5": "pass",
  "IC6": "unknown",
  "IC7": "unknown",
  "eligible_for_pilot": false,
  "eligible_for_main": false,
  "exclusion_reason": "SCREENING-PENDING, not a permanent exclusion: independent pre-fix failure/post-fix pass now verifies the regression behavior, but complete IC6/IC7 review and final ground-truth/CCDG adjudication are still required before any pilot/main inclusion.",
  "notes": [
    "GitHub PR #770 is closed/merged; fixing commit bab5629f6b3cea44cf0622cdd92c8cefcfbf360a.",
    "Changed code includes AbstractTarBuilder, TarArchiveInputStream, TarFile, TarConstants and TarUtils; upstream also adds PaxHeaderOomTest.",
    "Independent reproduction workflow passed: https://github.com/MahmutVezir/dijitalikiz/actions/runs/37993954772. The same custom oversized-PAX regression test failed as expected on pre-fix commit 829b5dd6ffe976c0a03231e65790a65af9f3a6ee (missing MemoryLimitException) and passed on fixed commit bab5629f6b3cea44cf0622cdd92c8cefcfbf360a.",
    "Regression reproduction establishes fix behavior for this scenario; it does not by itself complete dataset eligibility, independent ground-truth adjudication, or IC6/IC7.",
    "Keep separate from the existing frozen 16-case confirmatory manifest."
  ]
}
