{
  "case_id": "commons-math-defects4j-MATH-938",
  "provenance_quality": "pass",
  "root_cause_quality": "pass",
  "fix_quality": "pass",
  "dependency_strength": "weak",
  "dependency_evidence": "Current evidence describes a localized Line.revert precision problem; a strong cross-component dependency is not established.",
  "ccdg_suitability": "weak",
  "contamination_risk": "unknown",
  "contamination_risk_reason": "No independent model-training exposure audit was performed.",
  "IC1": "pass",
  "IC2": "pass",
  "IC3": "pass",
  "IC4": "pass",
  "IC5": "fail",
  "IC6": "fail",
  "IC7": "pass",
  "eligible_for_pilot": false,
  "eligible_for_main": false,
  "exclusion_reason": "Cross-component eligibility criteria are not met.",
  "notes": [
    "Fix commit independently verified in apache/commons-math: 73605560b9f0205ac641ec602145756305a41f79."
  ]
}
